{
  "schemaVersion": "osks-export/v1",
  "id": "LIN-102",
  "title": "Linux Permissions, Capabilities, and Privilege Escalation",
  "volume": "vol_02_specializations",
  "chapter": "ch_systems",
  "version": "1.0.0",
  "stability": "static",
  "status": "Research",
  "taxonomy": {
    "domain": "defensive_security",
    "discipline": "linux_security",
    "technology": "linux",
    "skill_level": "intermediate"
  },
  "learning_outcomes": [
    "Understand Linux permission models and capability inheritance.",
    "Identify privilege escalation paths and apply least-privilege controls."
  ],
  "evidence": {
    "sources": [
      {
        "id": "NIST-800-53-AC-6",
        "type": "NIST",
        "authority": "Primary",
        "uri": null,
        "control": null
      }
    ]
  },
  "knowledge_graph": {
    "prerequisites": [],
    "next_topics": [],
    "lab_references": [
      "LAB-001"
    ],
    "glossary_terms": [
      "linux",
      "capabilities",
      "privilege_escalation"
    ],
    "mitre_attack": []
  },
  "rendered_html": "---\nid: \"LIN-102\"\ntitle: \"Linux Permissions, Capabilities, and Privilege Escalation\"\nvolume: \"vol_02_specializations\"\nchapter: \"ch_systems\"\nversion: \"1.0.0\"\nstability: \"static\"\nstatus: \"Research\"\n\ntaxonomy:\n  domain: \"defensive_security\"\n  discipline: \"linux_security\"\n  technology: \"linux\"\n  skill_level: \"intermediate\"\n\nlearning_outcomes:\n  - \"Understand Linux permission models and capability inheritance.\"\n  - \"Identify privilege escalation paths and apply least-privilege controls.\"\n\nevidence:\n  sources:\n    - id: \"NIST-800-53-AC-6\"\n      type: \"NIST\"\n      authority: \"Primary\"\n\nknowledge_graph:\n  prerequisites: []\n  next_topics: []\n  lab_references: [\"LAB-001\"]\n  glossary_terms: [\"linux\", \"capabilities\", \"privilege_escalation\"]\n  mitre_attack: []\n---\n\n# LIN-102: Linux Permissions, Capabilities, and Privilege Escalation\n\n## 📌 1. Module Overview & Domain Mechanics\n> Scope, threat landscape relevance, and protocol/system operational context.\n\n---\n\n## 🎯 2. Prerequisites & Target Learning Outcomes\n### Prerequisites\n* None (Foundational Module)\n\n### Learning Objectives\n- [ ] Understand Linux permission models and capability inheritance.\n- [ ] Identify privilege escalation paths and apply least-privilege controls.\n\n---\n\n## 🧠 3. Technical Deep-Dive & Architecture\n### Flow Overview\nThis section provides a concise technical walkthrough of the module's core mechanisms, operational behavior, and defensive relevance. The content is intended to be expanded with verified research evidence during the writing stage.\n\n### Key Mechanics\n- Describe the protocol, system, or control behavior in sequence.\n- Call out important fields, state transitions, timing, or dependencies.\n- Explain how the mechanism can be observed, monitored, or defended against.\n\n### Example Execution Flow\n```text\nStart -> Observe -> Analyze -> Respond\n```\n\n### Why It Matters\nUnderstanding the underlying mechanics improves detection fidelity, incident response accuracy, and hardening decisions.\n\n---\n\n## ⚡ 4. Operational Commands & Tooling\n*(See companion document [commands.md](commands.md) for verified syntax)*\n\n---\n\n## 🧪 5. Hands-on Lab Mapping\n* **Associated Lab Setup**: [LAB-001](../../../labs/LAB-001.md)\n\n---\n\n## 🛡️ 6. Enterprise Defense & Hardening\n* **Offensive Mechanics**: Review how adversaries exploit the underlying mechanism, including abuse of defaults, weak validation, or timing gaps.\n* **Defensive Controls**: Apply least privilege, validate control state, monitor for misuse patterns, and document compensating controls for operational teams.\n\n---\n\n## 📚 7. Reference & Citation Matrix\n* **[Primary Authority]** `NIST-800-53-AC-6` (NIST)\n",
  "changelog": []
}